<?xml version="1.0" encoding="UTF-8"?>
<root xmlns:xsi="http://www.w3.org/2001/XMLSchema-instance"
    xsi:noNamespaceSchemaLocation="datatypeInteger.xsd">
    <!-- Built-in Type: Integer -->
    <integer>121</integer>
    <integer>11235451351531351</integer>
    <integer>-68168168468468435168168468468468846</integer>
    <rInteger>32183782190</rInteger>
    <nonPositiveInteger>-552</nonPositiveInteger>
    <negativeInteger>-4</negativeInteger>
    <long>2135151351</long>
    <long>1231538438555555559</long>
    <int>5435</int>
    <short>14155</short>
    <byte>106</byte>
    <nonNegativeInteger>0</nonNegativeInteger>
    <nonNegativeInteger>1816846816168161861616165156165</nonNegativeInteger>
    <unsignedLong>12678967543233</unsignedLong> 
    <positiveInteger>12135</positiveInteger>
    <unsignedInt>5858</unsignedInt>
    <unsignedShort>19955</unsignedShort>
    <unsignedByte>199</unsignedByte>
    <bNBit>9999999999999999995</bNBit>
    <lNBit>999999999999955</lNBit>
    <iNBit>99999555</iNBit>
</root>
